id,nome,descricao,quantidade,data_cadastr
1,Geraldine Estes,"quam a felis ullamcorper viverra. Maecenas iaculis aliquet diam. Sed diam lorem, auctor quis, tristique ac, eleifend vitae, erat. Vivamus",936,"23, 12,2022"
2,Talon Carson,"malesuada vel, convallis in, cursus et, eros. Proin ultrices. Duis volutpat nunc sit amet metus. Aliquam erat volutpat. Nulla facilisis.",395,"24, 03,2022"
3,Ezra Castaneda,"Vivamus nibh dolor, nonummy ac, feugiat non, lobortis quis, pede. Suspendisse dui. Fusce diam nunc, ullamcorper eu, euismod ac, fermentum",580,"20, 37,2022"
4,Norman Fox,"pede. Cum sociis natoque penatibus et magnis dis parturient montes, nascetur ridiculus mus. Proin vel arcu eu odio tristique pharetra.",78,"27, 56,2021"
5,Callum Cross,a odio semper cursus. Integer mollis. Integer tincidunt aliquam arcu. Aliquam ultrices iaculis odio. Nam interdum enim non nisi. Aenean,677,"13, 09,2022"
6,Bevis Witt,consectetuer ipsum nunc id enim. Curabitur massa. Vestibulum accumsan neque et nunc. Quisque ornare tortor at risus. Nunc ac sem,319,"20, 50,2021"
7,Aaron Guerra,"dui, in sodales elit erat vitae risus. Duis a mi fringilla mi lacinia mattis. Integer eu lacus. Quisque imperdiet, erat",162,"14, 48,2022"
8,Dacey Valencia,"dolor, tempus non, lacinia at, iaculis quis, pede. Praesent eu dui. Cum sociis natoque penatibus et magnis dis parturient montes,",284,"26, 54,2023"
9,Elijah Mcdowell,"dapibus gravida. Aliquam tincidunt, nunc ac mattis ornare, lectus ante dictum mi, ac mattis velit justo nec ante. Maecenas mi",985,"28, 15,2023"
10,Thaddeus Cotton,"eu nulla at sem molestie sodales. Mauris blandit enim consequat purus. Maecenas libero est, congue a, aliquet vel, vulputate eu,",465,"11, 11,2022"
